<?xml version="1.0"  encoding="UTF-8"?>
<!DOCTYPE DTD_E_Sports SYSTEM "DTD_E_Sports.dtd">
<liga cod="">
	<jornadas>
		<jornada cod="" fecha="">
			<fecha></fecha>
			<partidos>
				<partido cod="">
					<equipoA>
						<codigoEquipo></codigoEquipo>
					</equipoA>
					<equipoB>
						<codigoEquipo></codigoEquipo>
					</equipoB>
				</partido>
			</partidos>
		</jornada>
	</jornadas>
	<equipos>
		<equipo cod="">
			<nombre></nombre>
			<presupuesto></presupuesto>
			<localidad></localidad>
		</equipo>
	</equipos>
	<jugadores>
		<jugador cod="">
			<nombre></nombre>
			<apellido></apellido>
			<nickname></nickname>
			<sueldo></sueldo>
			<nacionalidad></nacionalidad>
			<estado></estado>
		<jugador>
	<jugadores>
	<due単os>
		<due単o cod="">
			<nombre></nombre>
			<apellido></apellido>
		</due単o>
	</due単os>
</liga>